<?xml version="1.0" encoding="utf-8"?>
<Employees xmlns:xsi="http://www.w3.org/2001/XMLSchema-instance" xsi:noNamespaceSchemaLocation="employees.xsd">
    <Employee>
        <Name>Пётр</Name>
        <Surname>Петров</Surname>
        <Patronymic>Петрович</Patronymic>
        <Gender>М</Gender>
        <BirthDate>1985-06-15</BirthDate>
        <Address>Пр. Ленина, 1</Address>
        <PhoneNumber>89008001234</PhoneNumber>
        <Email>petr@example.com</Email>
        <HireDate>2020-01-10</HireDate>
        <INN>123456789111</INN>
        <SNILS>12345678900</SNILS>
        <PassportSeries>1234</PassportSeries>
        <PassportNumber>567890</PassportNumber>
        <PassportIssueDate>2005-04-20</PassportIssueDate>
        <PassportIssueBy>МВД</PassportIssueBy>
        <PlaceOfReg>Чебоксары</PlaceOfReg>
        <PhotoPath>C:\\Users\\Александр\\EmployeeFormsApp\\Photo\\Dog.jpg</PhotoPath>
        <BranchId>3</BranchId>
        <DepartmentId>1</DepartmentId>
    </Employee>
    <Employee>
        <Name>Екатерина</Name>
        <Surname>Яковлева</Surname>
        <Patronymic>Сергеевна</Patronymic>
        <Gender>Ж</Gender>
        <BirthDate>1990-09-25</BirthDate>
        <Address>Пр. Ивана Яковлева</Address>
        <PhoneNumber>89234567890</PhoneNumber>
        <Email>ekaterina@example.com</Email>
        <HireDate>2021-05-15</HireDate>
        <INN>987654321111</INN>
        <SNILS>98765432100</SNILS>
        <PassportSeries>4321</PassportSeries>
        <PassportNumber>098765</PassportNumber>
        <PassportIssueDate>2010-08-10</PassportIssueDate>
        <PassportIssueBy>МВД</PassportIssueBy>
        <PlaceOfReg>Чебоксары</PlaceOfReg>
        <PhotoPath>C:\\Users\\Александр\\EmployeeFormsApp\\Photo\\Dog.jpg</PhotoPath>
        <BranchId>3</BranchId>
        <DepartmentId>1</DepartmentId>
    </Employee>
     <Employee>
        <Name>Джон</Name>
        <Surname>Смит</Surname>
    </Employee>
</Employees>